{
  "file": "officeparser.ods",
  "format": "ods",
  "source": "officeparser (MIT)",
  "verified": false,
  "features": {
    "text": {
      "paragraph_count": 0,
      "total_words": 464,
      "key_phrases": []
    },
    "headings": null,
    "tables": {
      "present": true,
      "count": 9,
      "total_rows": 103,
      "has_merged_cells": true
    },
    "track_changes": null,
    "comments": null,
    "headers_footers": null,
    "footnotes_endnotes": null,
    "speaker_notes": null,
    "text_boxes": null,
    "images": {
      "present": false,
      "count": 0
    },
    "lists": null,
    "metadata": {
      "title": "",
      "author": "",
      "created": "2025-12-26T10:17:43Z",
      "modified": ""
    },
    "sheets": {
      "present": true,
      "names": [
        "Sheet1",
        "Sheet2",
        "Sheet3",
        "Sheet4",
        "Sheet5",
        "Sheet6",
        "Sheet7",
        "Sheet8",
        "Chart_Sheet"
      ]
    }
  },
  "full_text_words": [
    "1",
    "10",
    "100",
    "103",
    "11",
    "110",
    "12",
    "13",
    "14",
    "15",
    "16",
    "165",
    "17",
    "18",
    "19",
    "2",
    "20",
    "2007",
    "202",
    "21",
    "210",
    "22",
    "23",
    "24",
    "25",
    "26",
    "27",
    "28",
    "29",
    "3",
    "30",
    "31",
    "32",
    "35",
    "37",
    "4",
    "43",
    "5",
    "53",
    "54",
    "56",
    "6",
    "64",
    "7",
    "8",
    "87",
    "9",
    "90",
    "908",
    "91",
    "93",
    "998",
    "a",
    "ability",
    "absolute",
    "action",
    "add",
    "additionally",
    "aligned",
    "all",
    "also",
    "alternating",
    "amongst",
    "an",
    "analogous",
    "and",
    "announcement",
    "another",
    "apart",
    "appears",
    "are",
    "as",
    "at",
    "attention",
    "automatically",
    "available",
    "azw3",
    "b",
    "back",
    "background",
    "backlinks",
    "be",
    "been",
    "best",
    "blue",
    "body",
    "bold",
    "books",
    "border",
    "borders",
    "both",
    "box",
    "bullet",
    "bulleted",
    "bullets",
    "button",
    "by",
    "c",
    "calendar",
    "calibre",
    "can",
    "cap",
    "caps",
    "cases",
    "category",
    "cedar",
    "cells",
    "centered",
    "change",
    "charts",
    "city",
    "click",
    "close",
    "college",
    "colors",
    "column",
    "common",
    "complex",
    "continued",
    "conversion",
    "convert",
    "converted",
    "converting",
    "corner",
    "correctly",
    "crazy",
    "creating",
    "d",
    "data",
    "december",
    "demonstrate",
    "demonstrated",
    "demonstrates",
    "demonstration",
    "devices",
    "dialog",
    "display",
    "displayed",
    "do",
    "document",
    "docx",
    "does",
    "don",
    "download",
    "drop",
    "dropcaps",
    "during",
    "e",
    "ease",
    "ebook",
    "ebooks",
    "either",
    "elements",
    "elm",
    "embedded",
    "emphasis",
    "emphasize",
    "end",
    "endnotes",
    "endnotesi",
    "ensure",
    "epub",
    "equal",
    "essential",
    "even",
    "every",
    "example",
    "exception",
    "external",
    "extra",
    "extremely",
    "family",
    "fancier",
    "fancy",
    "fare",
    "features",
    "fictitious",
    "file",
    "five",
    "fixed",
    "floating",
    "focus",
    "followed",
    "font",
    "fonts",
    "footnotes",
    "footnotes1",
    "for",
    "format",
    "formatting",
    "four",
    "fri",
    "from",
    "fun",
    "general",
    "get",
    "given",
    "graduate",
    "graduating",
    "gray",
    "green",
    "handle",
    "handy",
    "hanging",
    "has",
    "have",
    "header",
    "here",
    "highlight",
    "highlighter",
    "horizontally",
    "how",
    "i",
    "identity",
    "if",
    "ii",
    "iii",
    "illustration",
    "image",
    "images",
    "in",
    "indent",
    "indents",
    "individual",
    "inline",
    "inner",
    "input",
    "inserted",
    "inside",
    "inspirational",
    "instance",
    "institute",
    "intense",
    "interruption",
    "into",
    "inverse",
    "is",
    "it",
    "italic",
    "item",
    "its",
    "itself",
    "iv",
    "keep",
    "kindles",
    "kinds",
    "large",
    "leading",
    "left",
    "let",
    "letter",
    "level",
    "life",
    "light",
    "like",
    "line",
    "lines",
    "link",
    "links",
    "list",
    "listing",
    "lists",
    "little",
    "locations",
    "long",
    "look",
    "lovers",
    "m",
    "majority",
    "many",
    "margin",
    "maximum",
    "may",
    "merged",
    "microsoft",
    "miscellaneous",
    "modern",
    "mon",
    "mono",
    "more",
    "motivated",
    "much",
    "multi",
    "narrow",
    "necessarily",
    "needed",
    "nested",
    "new",
    "newer",
    "next",
    "nice",
    "no",
    "normal",
    "not",
    "note",
    "notice",
    "now",
    "numbered",
    "oak",
    "occasional",
    "of",
    "oftencome",
    "ok",
    "on",
    "one",
    "only",
    "optimum",
    "or",
    "original",
    "other",
    "our",
    "out",
    "output",
    "page",
    "pair",
    "paragraph",
    "paragraphs",
    "partial",
    "pencils",
    "pens",
    "percentages",
    "pictures",
    "placing",
    "plugin",
    "poetry",
    "point",
    "pointing",
    "points",
    "possible",
    "preceding",
    "preserved",
    "previous",
    "programming",
    "properties",
    "public",
    "purposes",
    "quotes",
    "rather",
    "readers",
    "recognized",
    "red",
    "refer",
    "regular",
    "regularly",
    "relatively",
    "relevant",
    "requirements",
    "results",
    "resume",
    "retains",
    "right",
    "rop",
    "row",
    "rows",
    "run",
    "s",
    "same",
    "sat",
    "scheduled",
    "scissors",
    "screen",
    "screens",
    "section",
    "see",
    "series",
    "service",
    "set",
    "setting",
    "should",
    "simple",
    "simply",
    "single",
    "six",
    "so",
    "some",
    "something",
    "source",
    "special",
    "specify",
    "start",
    "stretched",
    "strikes",
    "strong",
    "struck",
    "structural",
    "students",
    "styled",
    "styles",
    "styling",
    "sub",
    "subscript",
    "subtle",
    "such",
    "sun",
    "superscript",
    "support",
    "supported",
    "t",
    "table",
    "tables",
    "take",
    "technology",
    "text",
    "than",
    "that",
    "the",
    "their",
    "then",
    "there",
    "these",
    "things",
    "this",
    "those",
    "three",
    "thu",
    "to",
    "too",
    "top",
    "total",
    "town",
    "tries",
    "trouble",
    "tue",
    "two",
    "typeface",
    "types",
    "typographic",
    "ubuntu",
    "undergraduate",
    "underlined",
    "units",
    "university",
    "up",
    "urge",
    "use",
    "used",
    "useful",
    "uses",
    "using",
    "usually",
    "various",
    "vary",
    "vast",
    "very",
    "video",
    "was",
    "we",
    "website",
    "wed",
    "well",
    "when",
    "where",
    "while",
    "whose",
    "wide",
    "width",
    "widths",
    "will",
    "with",
    "word",
    "working",
    "yellow",
    "you",
    "your"
  ]
}