{
  "file": "pandoc_planets.md",
  "format": "md",
  "source": "pandoc",
  "verified": false,
  "features": {
    "text": {
      "paragraph_count": 6,
      "total_words": 130,
      "key_phrases": [
        "+------------------+---------+------------+----------+-----------+----------+---",
        "+:=======:+:======:+=========+===========:+=========:+==========:+=========:+===",
        "+---------+--------+---------+------------+----------+-----------+----------+---",
        "+---------+--------+---------+------------+----------+-----------+----------+---",
        "+------------------+---------+------------+----------+-----------+----------+---"
      ]
    },
    "headings": {
      "present": false,
      "count": 0,
      "by_level": {}
    },
    "tables": {
      "present": true,
      "count": 4,
      "total_rows": 14,
      "has_merged_cells": false
    },
    "track_changes": null,
    "comments": null,
    "headers_footers": null,
    "footnotes_endnotes": null,
    "speaker_notes": null,
    "text_boxes": null,
    "images": {
      "present": false,
      "count": 0
    },
    "lists": {
      "present": false,
      "count": 0
    },
    "metadata": null,
    "sheets": null
  },
  "full_text_words": [
    "0",
    "0146",
    "1",
    "10",
    "102",
    "104",
    "108",
    "11",
    "110",
    "118",
    "12",
    "120",
    "1271",
    "1326",
    "14",
    "140",
    "142",
    "1433",
    "149",
    "15",
    "153",
    "16",
    "1638",
    "167",
    "17",
    "1898",
    "195",
    "2",
    "200",
    "2006",
    "2095",
    "225",
    "227",
    "23",
    "24",
    "24kg",
    "27",
    "2802",
    "2872",
    "3",
    "330",
    "370",
    "3933",
    "4",
    "4222",
    "4495",
    "464",
    "49",
    "5",
    "51",
    "5243",
    "528",
    "536",
    "5427",
    "5514",
    "568",
    "57",
    "5906",
    "6",
    "62",
    "642",
    "65",
    "67",
    "687",
    "6km",
    "7",
    "756",
    "778",
    "792",
    "8",
    "86",
    "87",
    "879",
    "9",
    "97",
    "984",
    "a",
    "about",
    "as",
    "c",
    "closest",
    "data",
    "day",
    "declassified",
    "density",
    "diameter",
    "distance",
    "dwarf",
    "earth",
    "from",
    "gas",
    "giants",
    "gravity",
    "hours",
    "ice",
    "in",
    "jovian",
    "jupiter",
    "kg",
    "km",
    "largest",
    "length",
    "m",
    "mars",
    "mass",
    "mean",
    "mercury",
    "moons",
    "name",
    "neptune",
    "notes",
    "number",
    "of",
    "our",
    "planet",
    "planets",
    "pluto",
    "red",
    "s",
    "saturn",
    "solar",
    "sun",
    "system",
    "temperature",
    "terrestrial",
    "the",
    "to",
    "uranus",
    "venus",
    "world"
  ]
}