{
  "file": "lo_listformat.odt",
  "format": "odt",
  "source": "libreoffice",
  "verified": false,
  "features": {
    "text": {
      "paragraph_count": 0,
      "total_words": 2,
      "key_phrases": []
    },
    "headings": {
      "present": false,
      "count": 0,
      "by_level": {}
    },
    "tables": {
      "present": false,
      "count": 0,
      "total_rows": 0,
      "has_merged_cells": false
    },
    "track_changes": {
      "present": false,
      "count": 0,
      "types": {},
      "authors": []
    },
    "comments": null,
    "headers_footers": {
      "present": false,
      "header_count": 0,
      "footer_count": 0
    },
    "footnotes_endnotes": {
      "present": false,
      "count": 0
    },
    "speaker_notes": null,
    "text_boxes": {
      "present": false,
      "count": 0
    },
    "images": {
      "present": false,
      "count": 0
    },
    "lists": {
      "present": true,
      "count": 1
    },
    "metadata": {
      "title": "",
      "author": "",
      "created": "2021-06-14T11:53:55.192000000",
      "modified": ""
    },
    "sheets": null
  },
  "full_text_words": [
    "1",
    "2"
  ]
}