{
  "file": "tables-with-incomplete-rows.docx",
  "format": "docx",
  "source": "original",
  "verified": false,
  "features": {
    "text": {
      "paragraph_count": 2,
      "total_words": 26,
      "key_phrases": [
        "Example of DOCX table where one or more rows is missing cells from the end."
      ]
    },
    "headings": {
      "present": false,
      "count": 0,
      "by_level": {}
    },
    "tables": {
      "present": true,
      "count": 6,
      "total_rows": 14,
      "has_merged_cells": true
    },
    "track_changes": {
      "present": false,
      "count": 0,
      "types": {},
      "authors": []
    },
    "comments": {
      "present": false,
      "count": 0,
      "authors": [],
      "texts": []
    },
    "headers_footers": {
      "present": false,
      "header_count": 0,
      "footer_count": 0
    },
    "footnotes_endnotes": {
      "present": false,
      "count": 0
    },
    "speaker_notes": null,
    "text_boxes": {
      "present": false,
      "count": 0
    },
    "images": {
      "present": false,
      "count": 0
    },
    "lists": {
      "present": false,
      "count": 0
    },
    "metadata": {
      "title": "",
      "author": "Bienioszek, Anna",
      "created": "2018-07-09T05:03:00Z",
      "modified": "2018-08-03T14:43:00Z"
    },
    "sheets": null
  },
  "full_text_words": [
    "a",
    "b",
    "c",
    "cells",
    "d",
    "data",
    "dato",
    "docx",
    "e",
    "end",
    "example",
    "f",
    "format",
    "from",
    "is",
    "missing",
    "more",
    "of",
    "one",
    "or",
    "rows",
    "strange",
    "table",
    "the",
    "where",
    "wtf"
  ]
}