{
  "file": "pandoc_table_list.docx",
  "format": "docx",
  "source": "pandoc",
  "verified": false,
  "features": {
    "text": {
      "paragraph_count": 1,
      "total_words": 7,
      "key_phrases": []
    },
    "headings": {
      "present": false,
      "count": 0,
      "by_level": {}
    },
    "tables": {
      "present": true,
      "count": 1,
      "total_rows": 1,
      "has_merged_cells": false
    },
    "track_changes": {
      "present": false,
      "count": 0,
      "types": {},
      "authors": []
    },
    "comments": {
      "present": false,
      "count": 0,
      "authors": [],
      "texts": []
    },
    "headers_footers": {
      "present": false,
      "header_count": 0,
      "footer_count": 0
    },
    "footnotes_endnotes": {
      "present": false,
      "count": 0
    },
    "speaker_notes": null,
    "text_boxes": {
      "present": false,
      "count": 0
    },
    "images": {
      "present": false,
      "count": 0
    },
    "lists": {
      "present": false,
      "count": 0
    },
    "metadata": {
      "title": "",
      "author": "Jesse Rosenthal",
      "created": "2015-02-13T14:04:00Z",
      "modified": "2015-02-13T14:05:00Z"
    },
    "sheets": null
  },
  "full_text_words": [
    "a",
    "bullet",
    "cell",
    "list",
    "numbered",
    "text",
    "with"
  ]
}