{
  "file": "image_vml.docx",
  "format": "docx",
  "source": "original",
  "verified": false,
  "features": {
    "text": {
      "paragraph_count": 2,
      "total_words": 7,
      "key_phrases": [
        "VML Image",
        "It should follow below:"
      ]
    },
    "headings": {
      "present": true,
      "count": 1,
      "by_level": {
        "1": 1
      }
    },
    "tables": {
      "present": false,
      "count": 0,
      "total_rows": 0,
      "has_merged_cells": false
    },
    "track_changes": {
      "present": false,
      "count": 0,
      "types": {},
      "authors": []
    },
    "comments": {
      "present": false,
      "count": 0,
      "authors": [],
      "texts": []
    },
    "headers_footers": {
      "present": true,
      "header_count": 0,
      "footer_count": 2
    },
    "footnotes_endnotes": {
      "present": false,
      "count": 0
    },
    "speaker_notes": null,
    "text_boxes": {
      "present": true,
      "count": 1
    },
    "images": {
      "present": true,
      "count": 1
    },
    "lists": {
      "present": false,
      "count": 0
    },
    "metadata": {
      "title": "Fictitious Transactions",
      "author": "Online2PDF.com",
      "created": "2015-01-20T12:20:00Z",
      "modified": "2015-01-20T12:20:00Z"
    },
    "sheets": null
  },
  "full_text_words": [
    "1",
    "below",
    "follow",
    "image",
    "it",
    "should",
    "vml"
  ]
}