{
  "file": "test_quoted.csv",
  "format": "csv",
  "source": "original",
  "verified": false,
  "features": {
    "text": {
      "paragraph_count": 0,
      "total_words": 26,
      "key_phrases": []
    },
    "headings": null,
    "tables": {
      "present": true,
      "count": 1,
      "total_rows": 5,
      "has_merged_cells": false
    },
    "track_changes": null,
    "comments": null,
    "headers_footers": null,
    "footnotes_endnotes": null,
    "speaker_notes": null,
    "text_boxes": null,
    "images": null,
    "lists": null,
    "metadata": null,
    "sheets": null
  },
  "full_text_words": [
    "1",
    "100",
    "2",
    "200",
    "300",
    "400",
    "brien",
    "chars",
    "city",
    "comma",
    "country",
    "description",
    "he",
    "hello",
    "jane",
    "john",
    "line",
    "name",
    "no",
    "o",
    "said",
    "simple",
    "smith",
    "special",
    "state",
    "value"
  ]
}