{
  "file": "pandoc_basic.xlsx",
  "format": "xlsx",
  "source": "pandoc",
  "verified": false,
  "features": {
    "text": {
      "paragraph_count": 0,
      "total_words": 26,
      "key_phrases": [
        "Secondary"
      ]
    },
    "headings": null,
    "tables": {
      "present": true,
      "count": 2,
      "total_rows": 8,
      "has_merged_cells": false
    },
    "track_changes": null,
    "comments": null,
    "headers_footers": null,
    "footnotes_endnotes": null,
    "speaker_notes": null,
    "text_boxes": null,
    "images": {
      "present": false,
      "count": 0
    },
    "lists": null,
    "metadata": {
      "title": "",
      "author": "Anton Antic",
      "created": "2025-11-05T12:13:01Z",
      "modified": "2025-11-05T12:15:31Z"
    },
    "sheets": {
      "present": false,
      "names": []
    }
  },
  "full_text_words": [
    "23",
    "35",
    "58",
    "a",
    "age",
    "antich",
    "anton",
    "blank",
    "bond",
    "cell",
    "column",
    "grand",
    "james",
    "just",
    "labels",
    "location",
    "main",
    "moscow",
    "of",
    "person",
    "random",
    "row",
    "secondary",
    "sum",
    "switzerland",
    "total"
  ]
}