{
  "file": "poi_sampleshow.pptx",
  "format": "pptx",
  "source": "apache poi",
  "verified": false,
  "features": {
    "text": {
      "paragraph_count": 3,
      "total_words": 33,
      "key_phrases": [
        "Title of the first slide",
        "Subtitle of the first slide",
        "This bit is in italic green",
        "This is the second slide",
        "It has bullet points on it"
      ]
    },
    "headings": {
      "present": true,
      "count": 4,
      "by_level": {
        "1": 2,
        "2": 2
      }
    },
    "tables": {
      "present": false,
      "count": 0,
      "total_rows": 0,
      "has_merged_cells": false
    },
    "track_changes": null,
    "comments": null,
    "headers_footers": null,
    "footnotes_endnotes": null,
    "speaker_notes": {
      "present": false,
      "count": 0
    },
    "text_boxes": {
      "present": false,
      "count": 0
    },
    "images": {
      "present": false,
      "count": 0
    },
    "lists": {
      "present": false,
      "count": 0
    },
    "metadata": {
      "title": "SlideShow Sample",
      "author": "Nick Burch",
      "created": "2008-01-04T11:58:07Z",
      "modified": "2018-04-18T15:37:10Z"
    },
    "sheets": null
  },
  "full_text_words": [
    "16",
    "a",
    "aren",
    "arial",
    "at",
    "bit",
    "black",
    "bullet",
    "different",
    "especially",
    "first",
    "font",
    "fun",
    "green",
    "has",
    "in",
    "is",
    "it",
    "italic",
    "like",
    "of",
    "on",
    "point",
    "points",
    "re",
    "second",
    "slide",
    "subtitle",
    "t",
    "the",
    "they",
    "this",
    "title"
  ]
}