{
  "file": "poi_many_merges.xlsx",
  "format": "xlsx",
  "source": "apache poi",
  "verified": false,
  "features": {
    "text": {
      "paragraph_count": 0,
      "total_words": 1,
      "key_phrases": [
        "Sheet1"
      ]
    },
    "headings": null,
    "tables": {
      "present": true,
      "count": 1,
      "total_rows": 4999,
      "has_merged_cells": false
    },
    "track_changes": null,
    "comments": null,
    "headers_footers": null,
    "footnotes_endnotes": null,
    "speaker_notes": null,
    "text_boxes": null,
    "images": {
      "present": false,
      "count": 0
    },
    "lists": null,
    "metadata": {
      "title": "",
      "author": "Chris Boyle",
      "created": "2015-05-05T15:29:28Z",
      "modified": "2015-05-05T15:58:22Z"
    },
    "sheets": {
      "present": false,
      "names": []
    }
  },
  "full_text_words": [
    "sheet1"
  ]
}