{
  "file": "xlsxwriter_chart.xlsx",
  "format": "xlsx",
  "source": "xlsxwriter (BSD-2-Clause)",
  "verified": false,
  "features": {
    "text": {
      "paragraph_count": 0,
      "total_words": 13,
      "key_phrases": [
        "Sheet1"
      ]
    },
    "headings": null,
    "tables": {
      "present": true,
      "count": 1,
      "total_rows": 4,
      "has_merged_cells": false
    },
    "track_changes": null,
    "comments": null,
    "headers_footers": null,
    "footnotes_endnotes": null,
    "speaker_notes": null,
    "text_boxes": null,
    "images": {
      "present": false,
      "count": 0
    },
    "lists": null,
    "metadata": {
      "title": "",
      "author": "John",
      "created": "2011-03-19T04:48:56Z",
      "modified": "2011-03-19T04:56:52Z"
    },
    "sheets": {
      "present": false,
      "names": []
    }
  },
  "full_text_words": [
    "1",
    "10",
    "12",
    "15",
    "2",
    "3",
    "4",
    "5",
    "6",
    "7",
    "8",
    "9",
    "sheet1"
  ]
}