{
  "file": "pandoc_inline_images.docx",
  "format": "docx",
  "source": "pandoc",
  "verified": false,
  "features": {
    "text": {
      "paragraph_count": 3,
      "total_words": 9,
      "key_phrases": [
        "This picture  is an identicon.",
        "Here is one   that links."
      ]
    },
    "headings": {
      "present": false,
      "count": 0,
      "by_level": {}
    },
    "tables": {
      "present": false,
      "count": 0,
      "total_rows": 0,
      "has_merged_cells": false
    },
    "track_changes": {
      "present": false,
      "count": 0,
      "types": {},
      "authors": []
    },
    "comments": {
      "present": false,
      "count": 0,
      "authors": [],
      "texts": []
    },
    "headers_footers": {
      "present": false,
      "header_count": 0,
      "footer_count": 0
    },
    "footnotes_endnotes": {
      "present": false,
      "count": 0
    },
    "speaker_notes": null,
    "text_boxes": {
      "present": false,
      "count": 0
    },
    "images": {
      "present": true,
      "count": 3
    },
    "lists": {
      "present": false,
      "count": 0
    },
    "metadata": {
      "title": "",
      "author": "Jesse Rosenthal",
      "created": "2014-08-07T19:22:00Z",
      "modified": "2016-11-02T15:10:00Z"
    },
    "sheets": null
  },
  "full_text_words": [
    "an",
    "here",
    "identicon",
    "is",
    "links",
    "one",
    "picture",
    "that",
    "this"
  ]
}