{
  "file": "challenge/challenge_nested_lists.docx",
  "format": "docx",
  "source": "generated (python-docx)",
  "verified": true,
  "features": {
    "text": {
      "paragraph_count": 2,
      "total_words": 25,
      "key_phrases": [
        "Project Requirements",
        "Frontend"
      ]
    },
    "headings": {
      "present": true,
      "count": 2,
      "by_level": {
        "1": 1,
        "2": 1
      }
    },
    "tables": {
      "present": false,
      "count": 0,
      "total_rows": 0,
      "has_merged_cells": false
    },
    "track_changes": {
      "present": false,
      "count": 0,
      "types": {},
      "authors": []
    },
    "comments": {
      "present": false,
      "count": 0,
      "authors": [],
      "texts": []
    },
    "headers_footers": {
      "present": false,
      "header_count": 0,
      "footer_count": 0
    },
    "footnotes_endnotes": {
      "present": false,
      "count": 0
    },
    "text_boxes": {
      "present": false,
      "count": 0
    },
    "images": {
      "present": false,
      "count": 0
    },
    "lists": {
      "present": true,
      "count": 2
    },
    "metadata": {
      "title": "",
      "author": "",
      "created": "",
      "modified": ""
    },
    "sheets": null
  },
  "full_text_words": [
    "api",
    "backend",
    "button",
    "component",
    "components",
    "database",
    "design",
    "endpoints",
    "form",
    "frontend",
    "implementation",
    "management",
    "migrations",
    "phase",
    "postgresql",
    "project",
    "react",
    "requirements",
    "schema",
    "state",
    "timeline",
    "weeks"
  ]
}