{
  "file": "poi_table.pptx",
  "format": "pptx",
  "source": "apache poi",
  "verified": false,
  "features": {
    "text": {
      "paragraph_count": 0,
      "total_words": 0,
      "key_phrases": []
    },
    "headings": {
      "present": false,
      "count": 0,
      "by_level": {}
    },
    "tables": {
      "present": true,
      "count": 1,
      "total_rows": 5,
      "has_merged_cells": false
    },
    "track_changes": null,
    "comments": null,
    "headers_footers": null,
    "footnotes_endnotes": null,
    "speaker_notes": {
      "present": false,
      "count": 0
    },
    "text_boxes": {
      "present": false,
      "count": 0
    },
    "images": {
      "present": false,
      "count": 0
    },
    "lists": {
      "present": false,
      "count": 0
    },
    "metadata": {
      "title": "PowerPoint Presentation",
      "author": "Andreas Beeker",
      "created": "2015-11-19T23:16:46Z",
      "modified": "2015-11-20T23:48:24Z"
    },
    "sheets": null
  },
  "full_text_words": []
}