{
  "file": "test.md",
  "format": "md",
  "source": "original",
  "verified": false,
  "features": {
    "text": {
      "paragraph_count": 5,
      "total_words": 57,
      "key_phrases": [
        "DocParse Test Document",
        "Introduction",
        "This is a test markdown document for verifying the AILANG markdown parser. It co",
        "Features",
        "Headings"
      ]
    },
    "headings": {
      "present": true,
      "count": 7,
      "by_level": {
        "1": 1,
        "2": 3,
        "3": 3
      }
    },
    "tables": {
      "present": true,
      "count": 1,
      "total_rows": 3,
      "has_merged_cells": false
    },
    "track_changes": null,
    "comments": null,
    "headers_footers": null,
    "footnotes_endnotes": null,
    "speaker_notes": null,
    "text_boxes": null,
    "images": {
      "present": false,
      "count": 0
    },
    "lists": {
      "present": true,
      "count": 2
    },
    "metadata": null,
    "sheets": null
  },
  "full_text_words": [
    "1",
    "6",
    "a",
    "ail",
    "ailang",
    "and",
    "are",
    "block",
    "conclusion",
    "contains",
    "csv",
    "different",
    "docparse",
    "document",
    "done",
    "features",
    "first",
    "for",
    "format",
    "formats",
    "from",
    "headings",
    "here",
    "html",
    "introduction",
    "is",
    "it",
    "item",
    "items",
    "level",
    "lists",
    "markdown",
    "multiple",
    "one",
    "ordered",
    "parser",
    "parsers",
    "planned",
    "pure",
    "second",
    "several",
    "some",
    "status",
    "step",
    "supports",
    "tables",
    "test",
    "the",
    "third",
    "this",
    "three",
    "through",
    "two",
    "types",
    "unordered",
    "verifying",
    "with"
  ]
}