{
  "file": "test.tsv",
  "format": "tsv",
  "source": "original",
  "verified": false,
  "features": {
    "text": {
      "paragraph_count": 0,
      "total_words": 29,
      "key_phrases": []
    },
    "headings": null,
    "tables": {
      "present": true,
      "count": 1,
      "total_rows": 5,
      "has_merged_cells": false
    },
    "track_changes": null,
    "comments": null,
    "headers_footers": null,
    "footnotes_endnotes": null,
    "speaker_notes": null,
    "text_boxes": null,
    "images": null,
    "lists": null,
    "metadata": null,
    "sheets": null
  },
  "full_text_words": [
    "0",
    "2",
    "25",
    "28",
    "3",
    "30",
    "32",
    "35",
    "5",
    "7",
    "87",
    "88",
    "91",
    "93",
    "95",
    "age",
    "alice",
    "berlin",
    "bob",
    "charlie",
    "city",
    "diana",
    "eve",
    "london",
    "madrid",
    "name",
    "paris",
    "rome",
    "score"
  ]
}