{
  "file": "lo_merged.ods",
  "format": "ods",
  "source": "libreoffice",
  "verified": false,
  "features": {
    "text": {
      "paragraph_count": 0,
      "total_words": 5,
      "key_phrases": []
    },
    "headings": null,
    "tables": {
      "present": true,
      "count": 2,
      "total_rows": 2,
      "has_merged_cells": true
    },
    "track_changes": null,
    "comments": null,
    "headers_footers": null,
    "footnotes_endnotes": null,
    "speaker_notes": null,
    "text_boxes": null,
    "images": {
      "present": false,
      "count": 0
    },
    "lists": null,
    "metadata": {
      "title": "",
      "author": "dack_x",
      "created": "2012-06-07T00:05:51",
      "modified": ""
    },
    "sheets": {
      "present": true,
      "names": [
        "Sheet1",
        "Sheet2"
      ]
    }
  },
  "full_text_words": [
    "another",
    "merged",
    "on",
    "sheet",
    "yet"
  ]
}