{
  "file": "sample.docx",
  "format": "docx",
  "source": "original",
  "verified": false,
  "features": {
    "text": {
      "paragraph_count": 2,
      "total_words": 62,
      "key_phrases": [
        "Introduction",
        "This is a test document for the AILANG DocParse demo. It contains headings, para",
        "Features",
        "Sample Data Table",
        "Conclusion"
      ]
    },
    "headings": {
      "present": true,
      "count": 4,
      "by_level": {
        "1": 2,
        "2": 2
      }
    },
    "tables": {
      "present": true,
      "count": 1,
      "total_rows": 3,
      "has_merged_cells": false
    },
    "track_changes": {
      "present": false,
      "count": 0,
      "types": {},
      "authors": []
    },
    "comments": {
      "present": false,
      "count": 0,
      "authors": [],
      "texts": []
    },
    "headers_footers": {
      "present": false,
      "header_count": 0,
      "footer_count": 0
    },
    "footnotes_endnotes": {
      "present": false,
      "count": 0
    },
    "speaker_notes": null,
    "text_boxes": {
      "present": false,
      "count": 0
    },
    "images": {
      "present": false,
      "count": 0
    },
    "lists": {
      "present": true,
      "count": 3
    },
    "metadata": {
      "title": "DocParse Test Document",
      "author": "AILANG Demo",
      "created": "2026-02-08T00:00:00Z",
      "modified": "2026-02-08T12:00:00Z"
    },
    "sheets": null
  },
  "full_text_words": [
    "a",
    "ai",
    "ailang",
    "and",
    "augmented",
    "bounded",
    "budgets",
    "capability",
    "compared",
    "conclusion",
    "contains",
    "contract",
    "costs",
    "data",
    "demo",
    "docparse",
    "document",
    "docx",
    "dom",
    "elegant",
    "excel",
    "extension",
    "features",
    "for",
    "format",
    "functional",
    "headings",
    "imperative",
    "introduction",
    "is",
    "it",
    "layout",
    "lists",
    "matching",
    "on",
    "paragraphs",
    "parsing",
    "pattern",
    "planned",
    "powerpoint",
    "pptx",
    "provides",
    "pure",
    "safe",
    "sample",
    "status",
    "supported",
    "table",
    "test",
    "the",
    "this",
    "to",
    "traversal",
    "trees",
    "type",
    "understanding",
    "verified",
    "via",
    "with",
    "word",
    "xlsx",
    "xml"
  ]
}